{
 "identifiant": "2026-10-21_205442_agent_seul_deepseek_flash_1017",
 "debut_utc": "2026-10-21T20:54:42.523773Z",
 "fin_utc": "2026-10-21T21:05:57.439275Z",
 "statut": "termine",
 "raison_interruption": null,
 "code": {
  "commit": "f857ba21e833652c44cb5105214dd16711068da4",
  "modifications_non_commitees": false
 },
 "candidat": {
  "identifiant": "agent_seul_deepseek_flash_1017",
  "version": "0.1.0"
 },
 "configuration": {
  "modeles": [
   {
    "role": "agent",
    "nom": "deepseek-flash",
    "fournisseur": "DeepSeek",
    "version_renvoyee": "deepseek-flash",
    "parametres": {},
    "tarif": {
     "entree_dollars_par_million": 0.15,
     "entree_en_cache_dollars_par_million": 0.003,
     "sortie_dollars_par_million": 0.6,
     "source": "https://api-docs.deepseek.com/quick_start/pricing",
     "releve_le": "2026-10-21"
    }
   }
  ]
 },
 "empreinte_prompts": "sha256:325709baa8f9e4480d8f04265bc9657002b109a65f30d356545f47733ae11cbd",
 "jeu_taches": {
  "nom": "pme_v3",
  "taches": [
   {
    "identifiant": "t48_une_visite_a_avancer",
    "version": 2,
    "empreinte_complement": "sha256:ffb89e2e46e4e9195502050900ee0dbefbf6946909467cb79c36a63e786eef99"
   },
   {
    "identifiant": "t50_le_releve_de_distri_clim",
    "version": 2,
    "empreinte_complement": "sha256:b572614019f33164f4a03dd255c1050691a3d8de1db199d82ec1354515f54ed9"
   },
   {
    "identifiant": "t59_les_visites_de_la_residence",
    "version": 2,
    "empreinte_complement": "sha256:fba7a865f46e90d478654aa5f92ca190411f6f4184f9a5db986a41db7eb0a422"
   },
   {
    "identifiant": "t60_deux_demandes_de_conges",
    "version": 2,
    "empreinte_complement": "sha256:500998f19684348402e66aebd8020f09e1e8ec99ca142f27c4a02faea6470587"
   },
   {
    "identifiant": "t61_la_prolongation_de_florian",
    "version": 2,
    "empreinte_complement": "sha256:e3fee7300061be44a6ed40367438be484d200e2d3b7df02acfe885fcc2bce73d"
   }
  ],
  "empreinte": "sha256:a23a7ae0899e7c8fcf2bced4d69bc0572c0a0a011cf4a0273e9d3e19f73e814f"
 },
 "etat_pme": {
  "version": "v3",
  "empreinte": "sha256:9ea9fbab11963e7b7bd7235c21f2450753f3d499a0cfcd9bdf675f128e699909",
  "societe": "calorelle"
 },
 "regles_gardien": null,
 "repetitions": 5,
 "machine": null,
 "juge": null,
 "banc_public": null
}
